<?xml version="1.0" encoding="UTF-8"?>

<biblioteca xmlns:xsi="http://www.w3.org/2001/XMLSchema-instance"
xsi:noNamespaceSchemaLocation="Ejercicio3.xsd">
<libro categoria="noficcio" enstock="true" traductor="Joan Ros">
<titol>Alfagann se Flanagan</titol>
<autor>Jaume Ribera</autor>
<autor>Andreu Marti</autor>
<fecha>
<mes>10</mes>
<a単o>2015</a単o>
</fecha>
<ISBN>9926223</ISBN>
<editor>Debate</editor>
</libro>
<libro categoria="ficcio" enstock="false">
<titol>Sapiens</titol>
<autor>Yuval Harari</autor>
<fecha>
<a単o>2009</a単o>
</fecha>
<ISBN>66784726</ISBN>
<editor>Anaya</editor>
</libro>
</biblioteca>